{
  "$schema": "../sandbox-readiness-review.schema.json",
  "schema_version": 1,
  "review_id": "SANDBOX.READINESS_REVIEW.NOCLAIM_TEMPLATE.2026_07",
  "status": "no_claim_sandbox_readiness_template",
  "updated": "2026-07-18",
  "claim_status": "Sandbox readiness-review template only; no owner review, no security review, no platform review, no quality review, no release-operations review, no packaged expected-deny probes, no effective platform policy review, no host-safe fixture review, no broker fixture review, no compromised-client harness review, no platform matrix review, no result-record review, no failure-denominator review, no cleanup review, no sandbox-readiness claim, no renderer-security claim, no site-isolation claim, no hostile-browsing safety claim, no platform containment claim, no SEC-GATE-1 claim, no SEC-GATE-6 claim, no production-safety claim, and no implementation claim.",
  "source_records": [
    "docs/research/sandbox-probe-inventory-2026-07.md",
    "docs/security-engine/machine/sandbox-probe-inventory.schema.json",
    "docs/security-engine/machine/sandbox-probe-inventory.json",
    "docs/security-engine/machine/sandbox-probe-package.schema.json",
    "docs/security-engine/machine/sandbox-probe-packages/no-claim-expected-deny-template.json",
    "docs/security-engine/machine/sandbox-readiness-review.schema.json",
    "docs/security-engine/machine/sandbox-readiness-reviews/no-claim-sandbox-readiness-template.json",
    "docs/blueprint-v1/machine/process-capabilities.json",
    "docs/blueprint-v1/machine/pre-build-readiness.json",
    "docs/blueprint-v1/machine/build-readiness-task-queue.json",
    "docs/blueprint-v1/machine/research-readiness-crosswalk.json",
    "docs/blueprint-v1/04-system-architecture.md",
    "docs/blueprint-v1/08-security-and-sandbox.md",
    "docs/blueprint-v1/12-testing-compatibility.md",
    "docs/security-engine/01-threat-model-and-process-isolation.md",
    "docs/security-engine/02-sandbox-brokers-and-platform-containment.md",
    "docs/security-engine/06-security-verification-and-release-gates.md",
    "docs/platform/README.md",
    "docs/project-buildout/11-pre-build-readiness-checklist.md",
    "docs/project-buildout/13-build-readiness-operating-board.md",
    "docs/project-buildout/17-build-readiness-task-queue.md",
    "docs/project-buildout/18-documentation-readiness-evidence-matrix.md",
    "tools/validate_sandbox_probe_inventory.py",
    "tools/validate_sandbox_readiness_review.py",
    "tools/validate_blueprint.py",
    "tools/check.ps1"
  ],
  "review_scope": {
    "probe_inventory": null,
    "probe_package": null,
    "owner_reviewer": null,
    "security_reviewer": null,
    "platform_reviewer": null,
    "quality_reviewer": null,
    "release_operations_reviewer": null,
    "review_status": "template_only_no_review",
    "prohibited_placeholder_policy": "Template records must not leave null fields in a real sandbox readiness review or name placeholder probe inventories, probe packages, owner reviewers, security reviewers, platform reviewers, quality reviewers, release-operations reviewers, title-only approval, self-approval, or implied PB-012 readiness authority."
  },
  "readiness_status": {
    "owner_reviewed": false,
    "security_reviewed": false,
    "platform_reviewed": false,
    "quality_reviewed": false,
    "release_operations_reviewed": false,
    "probe_inventory_reviewed": false,
    "probe_package_reviewed": false,
    "packaged_expected_deny_probes_reviewed": false,
    "effective_policy_reviewed": false,
    "host_safe_fixtures_reviewed": false,
    "broker_fixtures_reviewed": false,
    "compromised_client_harnesses_reviewed": false,
    "platform_matrix_reviewed": false,
    "result_records_reviewed": false,
    "failure_denominator_reviewed": false,
    "cleanup_reviewed": false,
    "sandbox_readiness_supported": false,
    "renderer_security_supported": false,
    "site_isolation_supported": false,
    "hostile_browsing_safety_supported": false,
    "platform_containment_supported": false,
    "sec_gate_1_supported": false,
    "sec_gate_6_supported": false,
    "production_safety_supported": false,
    "implementation_claim_supported": false
  },
  "probe_package_axes": [
    { "axis": "packaged role runner", "required_evidence": "Owner-reviewed packaged role runner launches each role through the same process, handle set, sandbox primitive, and broker policy used by the evaluated configuration beyond the checked no-claim sandbox readiness-review template.", "template_status": "missing in template" },
    { "axis": "artifact build ID", "required_evidence": "Probe package records artifact build ID, source revision, command line, compiler profile, policy artifact hashes, stdout hash, and stderr hash.", "template_status": "not executed in template" },
    { "axis": "role launch path", "required_evidence": "Role launch path proves renderer, network, storage, GPU, decoder, extension, DevTools, agent, and updater roles run under their intended policy.", "template_status": "not executed in template" },
    { "axis": "handle set", "required_evidence": "Inherited handles, brokered handles, descriptors, and platform-specific capabilities are captured before probes run.", "template_status": "not reviewed in template" },
    { "axis": "process identity", "required_evidence": "Process identity, token, entitlement, namespace, package SID, integrity level, and role metadata are retained in result records.", "template_status": "not reviewed in template" },
    { "axis": "result record schema", "required_evidence": "Stable result records include role, platform, surface, attempted operation, expected result, actual result, exit code, artifact hashes, cleanup status, owner review, and failure denominator.", "template_status": "not reviewed in template" },
    { "axis": "failure denominator", "required_evidence": "Every failed, skipped, unsupported, timed-out, cancelled, or rerun probe remains in the denominator before owner review.", "template_status": "not reviewed in template" }
  ],
  "platform_policy_axes": [
    { "axis": "windows effective policy", "required_evidence": "Windows evidence captures AppContainer or token identity, integrity level, restricted token, job object limits, process mitigations, dynamic-code policy, registry/COM/RPC/device/file/socket/debug denial logs, and inherited-handle inspection.", "template_status": "not executed in template" },
    { "axis": "macos effective policy", "required_evidence": "macOS evidence captures seatbelt or App Sandbox profile, entitlements, hardened runtime, JIT entitlement state, code signing identity, notarization or local test-signing state, broker descriptors, and sandbox extensions.", "template_status": "not executed in template" },
    { "axis": "linux effective policy", "required_evidence": "Linux evidence captures PID, mount, user, network, IPC, and cgroup namespace policy, seccomp filters, no-new-privileges, Landlock or portal policy, capabilities, cgroups, rlimits, broker descriptors, and denial logs.", "template_status": "not executed in template" },
    { "axis": "effective platform policy capture", "required_evidence": "Probe artifacts include effective platform policy, token/entitlement/namespace state, handle descriptors, degraded-state markers, unsupported-state markers, and policy artifact hashes.", "template_status": "missing in template" },
    { "axis": "platform matrix", "required_evidence": "macOS, Windows, and Linux evidence names OS version, primitive set, packaging mode, degraded state, unsupported state, and equivalent probe result coverage.", "template_status": "missing in template" },
    { "axis": "unsupported and degraded modes", "required_evidence": "Unsupported, skipped, degraded, disabled, unavailable, or host-incompatible sandbox primitives are recorded as blockers or waivers, not passes.", "template_status": "not reviewed in template" }
  ],
  "role_surface_axes": [
    { "axis": "renderer role", "required_evidence": "Renderer expected-deny probes cover hostile web content with assigned IPC, shared memory, surfaces, and read-only font handles only.", "template_status": "not executed in template" },
    { "axis": "network role", "required_evidence": "Network expected-deny probes cover ambient sockets outside kernel-issued request context plus forbidden password-vault and arbitrary-profile authority.", "template_status": "not executed in template" },
    { "axis": "storage role", "required_evidence": "Storage expected-deny probes cover cross-profile and private-session data outside assigned profile, origin, and partition handles.", "template_status": "not executed in template" },
    { "axis": "gpu role", "required_evidence": "GPU expected-deny probes cover unassigned surfaces, stale device generations, unvalidated shared memory, profile storage, network, credentials, and arbitrary filesystem access.", "template_status": "not executed in template" },
    { "axis": "decoder role", "required_evidence": "Decoder expected-deny probes cover hostile codecs, fonts, images, PDFs, archives, task-scoped input, bounded output, and no ambient authority.", "template_status": "not executed in template" },
    { "axis": "extension role", "required_evidence": "Extension expected-deny probes cover ungranted host access, native messaging, incognito policy, update signing, and agent confirmation authority.", "template_status": "not executed in template" },
    { "axis": "devtools role", "required_evidence": "DevTools expected-deny probes cover hidden remote listener creation, wrong target, wrong epoch, unattached profile access, and release signing authority.", "template_status": "not executed in template" },